{
  "$schema": "https://json-schema.org/draft/2020-12/schema",
  "$id": "https://datapass.local/schemas/datapass-catalog.schema.json",
  "title": "DataPass project catalog (1)",
  "type": "object",
  "additionalProperties": false,
  "properties": {
    "$schema": {
      "type": "string",
      "maxLength": 500
    },
    "format": {
      "const": "datapass.catalog"
    },
    "version": {
      "const": "1"
    },
    "title": {
      "type": "string",
      "minLength": 1,
      "maxLength": 200
    },
    "description": {
      "type": "string",
      "minLength": 1,
      "maxLength": 4000
    },
    "projects": {
      "type": "array",
      "items": {
        "type": "object",
        "additionalProperties": false,
        "properties": {
          "id": {
            "type": "string",
            "pattern": "^[a-z][a-z0-9_.-]{0,79}$"
          },
          "title": {
            "type": "string",
            "minLength": 1,
            "maxLength": 200
          },
          "organization": {
            "type": "string",
            "minLength": 1,
            "maxLength": 200
          },
          "description": {
            "type": "string",
            "minLength": 1,
            "maxLength": 4000
          },
          "repository": {
            "type": "object",
            "additionalProperties": false,
            "properties": {
              "url": {
                "type": "string",
                "maxLength": 500
              },
              "branch": {
                "type": "string",
                "pattern": "^[A-Za-z0-9._/-]{1,200}$"
              }
            },
            "required": [
              "url"
            ]
          },
          "manifest": {
            "type": "string",
            "minLength": 1,
            "maxLength": 400,
            "pattern": "^(?![/\\\\~])(?![A-Za-z]:)(?!.*(^|[/\\\\])\\.\\.([/\\\\]|$)).+$"
          },
          "tags": {
            "type": "array",
            "items": {
              "type": "string",
              "pattern": "^[a-z][a-z0-9_.-]{0,79}$"
            },
            "maxItems": 20,
            "minItems": 0
          }
        },
        "required": [
          "id",
          "title",
          "repository"
        ]
      },
      "maxItems": 200,
      "minItems": 0
    }
  },
  "required": [
    "format",
    "version",
    "projects"
  ]
}
